{
  "contract_version": "1.0",
  "verification_id": "verification-example-1",
  "subject_result_ref": "result-example-1",
  "status": "passed",
  "checks": [
    {
      "name": "reference-check",
      "status": "passed",
      "summary": "The result matches the declared acceptance condition"
    }
  ],
  "evidence": [
    {
      "contract_version": "1.0",
      "evidence_id": "evidence-verification-1",
      "kind": "verification",
      "summary": "Reference check passed",
      "source": "reference-checks",
      "collected_at": "2026-01-01T00:03:00Z"
    }
  ],
  "completed_at": "2026-01-01T00:03:00Z"
}
